id,dataType,username,title,communityName,body,url,createdAt
t3_7yh176,post,redreaverredreaver,Asked Alexa to play Garth Brooks & it called 911 instead?! WTF?! How do I make sure this doesn't happen again?!,r/amazonecho,"Asked Alexa to play Garth Brooks. Could immediately hear it ringing as if it was calling someone. Told it to hang up. Heard '911, what is the nature of your emergency.' It hung up, then proceeded to play Garth Brooks like the call never took place. What the ever loving fuck. I need to know how to disable all call functionality completely.",https://www.reddit.com/r/amazonecho/comments/7yh176/,2018-02-18T20:24:00.000Z
t1_dugk4ah,comment,aspirer42,Reply on Garth Brooks 911 post,r/amazonecho,"So, um, just to make sure... it didn't sound anything like this, by any chance? [It was the intro to a Garth Brooks song called '911']",https://www.reddit.com/r/amazonecho/comments/7yh176/dugk4ah/,2018-02-18T21:18:57.000Z
t3_1hg83uj,post,tokyographer,Why is Alexa still so dumb when ChatGPT exists?,r/amazonecho,"I'm genuinely baffled at how Alexa, after so many years and iterations, still feels so behind. I've bought three Amazon Echo devices and always end up returning them. I find it incredibly difficult to communicate with Alexa, particularly as someone with an accent. Any attempt to move beyond basic commands feels like hitting a brick wall. Conversations? Forget it. We now have ChatGPT that can hold natural, flowing conversations. So why is Alexa still this stupid? It's basically just a glorified clock with a speaker.",https://www.reddit.com/r/amazonecho/comments/1hg83uj/,2024-12-17T10:51:19.000Z
t1_m2h84wx,comment,DivasDayOff,Reply: Why is Alexa still so dumb,r/amazonecho,"They're supposedly bringing out an enhanced AI version of Alexa as a paid subscription model. So don't expect them to make the standard free Alexa smarter any time soon. Amazon never does anything out of kindness. The Echo devices were supposed to make voice ordering the norm for households, but that really failed. So they've ended up with the whole project being a bit of a white elephant.",https://www.reddit.com/r/amazonecho/comments/1hg83uj/m2h84wx/,2024-12-17T11:11:52.000Z
t1_m2iycuo,comment,alek_hiddel,Reply: Why is Alexa still so dumb,r/amazonecho,Alexa was supposed to help you add every household item to an Amazon order and cut out Walmart. I use mine exclusively for kitchen timers and checking the weather. Every major failure of Amazon since Bezos has boiled down to trying to repeat that original shopping revolution.,https://www.reddit.com/r/amazonecho/comments/1hg83uj/m2iycuo/,2024-12-17T17:50:36.000Z
t1_m2kvmvn,comment,Rongill1234,Reply: Alexa as kitchen timer,r/amazonecho,It's pretty godlike as a kitchen timer....,https://www.reddit.com/r/amazonecho/comments/1hg83uj/m2kvmvn/,2024-12-18T00:08:05.000Z
t1_m2ldvrw,comment,originalrocket,Reply: Alexa purpose,r/amazonecho,Does it have any other purpose? Besides displaying drink mixes when you need something quick for the guests?,https://www.reddit.com/r/amazonecho/comments/1hg83uj/m2ldvrw/,2024-12-18T01:59:41.000Z
t1_m2levoa,comment,c0ur7n3y,Reply: Alexa routines,r/amazonecho,"Routines are pretty neat. I have a routine that turns on the Christmas tree and plays 30 seconds of a holiday playlist. I also do one in the AM that gives the weather, tells me what's on my calendar today and tomorrow and does a NPR flash news brief.",https://www.reddit.com/r/amazonecho/comments/1hg83uj/m2levoa/,2024-12-18T02:05:55.000Z
t1_m2lg18m,comment,meatmacho,Reply: 10 years of Echo,r/amazonecho,"I've had multiple echos for about 10 years now. Outside the kitchen, they mostly just control lights and music. In the kitchen, it's good for timers, math (what's one third of 700ml in cups?), reminders, intercom drop-ins to other rooms, adding items to a shopping list. They're cheap. They clearly last. They'd be better if they were smarter and more AI-based. But they're perfectly fine for what they are.",https://www.reddit.com/r/amazonecho/comments/1hg83uj/m2lg18m/,2024-12-18T02:13:05.000Z
t1_m2n6i09,comment,dasonk,Reply: AI in Alexa concerns,r/amazonecho,"Honestly as a former Google ecosystem guy... I really hope any AI they add to Alexa is optional. Google assistant just got worse and worse as time went on. Alexa may not be smart but at least I can count on her for the things she is good at. If they start playing around with AI, reliability might take a slight hit.",https://www.reddit.com/r/amazonecho/comments/1hg83uj/m2n6i09/,2024-12-18T11:29:54.000Z
t1_m2ox1u9,comment,[deleted],Reply: Paid tier Alexa,r/amazonecho,"IIRC they plan on making it two tiered, the current iteration will remain the free version and the LLM powered version will be a paid subscription.",https://www.reddit.com/r/amazonecho/comments/1hg83uj/m2ox1u9/,2024-12-18T18:00:10.000Z
t1_m2r19ph,comment,BuffyBlue82,Reply: Learning Alexa,r/amazonecho,What is the best place to learn all of the different ways to use an Alexa? Mine is not working up to its full potential.,https://www.reddit.com/r/amazonecho/comments/1hg83uj/m2r19ph/,2024-12-19T00:55:59.000Z
t1_m2wf8b8,comment,meatmacho,Reply: How to learn Alexa,r/amazonecho,"I don't think I've ever read anything about it. I just ask it questions or give it commands, and sometimes it responds. Then I know it can do things like that. Also flipping through the app to learn about routines and different settings. That's how my kids learned they can ask her to change her name to Ziggy in their rooms.",https://www.reddit.com/r/amazonecho/comments/1hg83uj/m2wf8b8/,2024-12-19T23:20:18.000Z
t3_1ery747,post,goodguy5000hd,Fuck You Amazon,r/amazonecho,"I bought several Echo Shows last year in good faith. Nowhere did Amazon state that they'll show ads on Shows. I changed the language to avoid ads which worked for a while. Now, Amazon has closed this loophole and now my Echo Shows are fucking billboards invading my home. They're going in the trash. You should be paying ME to trash up my home with your billboard advertising. (My Echo Dots are increasingly adding the 'by the way' ads too. They'll be going into the garbage too if this continues.)",https://www.reddit.com/r/amazonecho/comments/1ery747/,2024-08-14T10:31:34.000Z
t1_li29qor,comment,Connect_Wrangler5072,Reply: Stop ads trick,r/amazonecho,I get No ads and No 'By the Way'! Turn on Night Mode for the clock so it runs 24/7. Next set a custom routine to play at say 4am on a device far away from where you are sleeping that says 'Stop by the Way'. Job done.,https://www.reddit.com/r/amazonecho/comments/1ery747/li29qor/,2024-08-14T12:23:15.000Z
t1_li2ybev,comment,thequestess,Reply: Echo Show ads frustration,r/amazonecho,"Except that I got the Show versus a Dot because I want to see my calendar, photos, weather, and the news. This just turns it into a glorified smart speaker with a clock. I don't use my Show to watch videos either, I use my TV for that.",https://www.reddit.com/r/amazonecho/comments/1ery747/li2ybev/,2024-08-14T14:50:05.000Z
t1_li7vye3,comment,Connect_Wrangler5072,Reply: Explanation of ads hack,r/amazonecho,"Two issues: 1st Show was showing too many Ads - turn on Night Mode. 2nd, the 'BY THE WAY' recommendations - set a routine at 4am with the command STOP BY THE WAY, this stops the device recommending things for 24 hours. Make sure you do it on a device far away from where you are sleeping.",https://www.reddit.com/r/amazonecho/comments/1ery747/li7vye3/,2024-08-15T10:38:52.000Z
t1_lim9yas,comment,TangentCat,Reply: Stop by the way weekly,r/amazonecho,"'Stop by the way' is good for a week. I have mine set to activate on my phone's Alexa app weekly in the middle of the night when my phone is already set to do not disturb. Works perfect, no audio.",https://www.reddit.com/r/amazonecho/comments/1ery747/lim9yas/,2024-08-17T20:44:35.000Z
t1_lipfm3j,comment,SheilaCreates,Reply: Gold tip,r/amazonecho,Set a custom routine to play at say 4am on a device far away from where you are sleeping that says 'Stop by the Way'. This is gold. Thank you!,https://www.reddit.com/r/amazonecho/comments/1ery747/lipfm3j/,2024-08-18T12:18:45.000Z
t3_h94qpc,post,Auto-Brad,What do you all think of my wife's Amazon Echo Dot stand?,r/amazonecho,[Image post of a creative custom 3D printed Echo Dot stand shaped like a robot],https://www.reddit.com/r/amazonecho/comments/h94qpc/,2020-06-14T23:56:20.000Z
t1_fuve0uv,comment,Darkleafar,Reply: Echo Dot stand,r/amazonecho,"If it starts walking, run.",https://www.reddit.com/r/amazonecho/comments/h94qpc/fuve0uv/,2020-06-15T04:50:19.000Z
t1_fuwm9m8,comment,nascentt,Reply: Echo Dot stand 2,r/amazonecho,"And if it starts running, play dead.",https://www.reddit.com/r/amazonecho/comments/h94qpc/fuwm9m8/,2020-06-15T14:46:22.000Z
t1_fuuql2b,comment,the_ham_guy,Reply: Echo Dot stand speaker,r/amazonecho,"Looks cool, but it's covering the speaker. I'm sure it doesn't sound very nice.",https://www.reddit.com/r/amazonecho/comments/h94qpc/fuuql2b/,2020-06-15T00:39:00.000Z
t1_fuxalhj,comment,kristianrusso,Reply: Echo Dot speaker location,r/amazonecho,"The speaker isn't really on the side but is on the top, look at the teardown from ifixit, the mesh on the side is fake.",https://www.reddit.com/r/amazonecho/comments/h94qpc/fuxalhj/,2020-06-15T17:59:38.000Z
t1_fuup2cx,comment,KamieKarla,Reply: Where to buy stand,r/amazonecho,Need one. Where get?,https://www.reddit.com/r/amazonecho/comments/h94qpc/fuup2cx/,2020-06-15T00:24:00.000Z
t1_fuup3sp,comment,Auto-Brad,Reply: Etsy link for stand,r/amazonecho,https://etsy.me/2MWgQ1w,https://www.reddit.com/r/amazonecho/comments/h94qpc/fuup3sp/,2020-06-15T00:24:39.000Z
t3_a9a1uy,post,TheBrownWelsh,"Never thought I'd need to use the Drop In feature, but it just saved my arse (ran out of toilet paper)",r/amazonecho,"Wife is downstairs. I'm in the bathroom with an upset tummy. Need to wipe. There is no wipe. TV is loud so she can't hear me. Remember Amazon Echo. Remember Drop In feature. Remember our Echo is plugged into the loudest speakers ever. Me: 'Houston we have a problem.' Wife: 'oh yeah, you totally do.' Thank you Amazon. You saved me from a poop-walk of shame.",https://www.reddit.com/r/amazonecho/comments/a9a1uy/,2018-12-24T23:48:08.000Z
t1_echqbra,comment,davabran,Reply: Drop In bathroom story,r/amazonecho,I've dropped in on my buddy taking a #2 in the bathroom while I was taking a #2 in the other bathroom. I'm pretty sure this is what this technology was planned for.,https://www.reddit.com/r/amazonecho/comments/a9a1uy/echqbra/,2018-12-25T00:46:42.000Z
t1_echt4r5,comment,EcstaticFun,Reply: Drop In oh shit moment,r/amazonecho,My first drop in story isn't as majestic as this. But I'm glad I'm not the only one that has dropped in with an 'oh shit' moment.,https://www.reddit.com/r/amazonecho/comments/a9a1uy/echt4r5/,2018-12-25T01:33:32.000Z
t1_echtk1r,comment,TheBrownWelsh,Reply: Drop In other uses,r/amazonecho,Do tell! I legitimately can't think of any other instances I'd use it until we get a few more Echo Dots to spread around the house.,https://www.reddit.com/r/amazonecho/comments/a9a1uy/echtk1r/,2018-12-25T01:40:25.000Z
t1_echtul7,comment,EcstaticFun,Reply: Drop In car key story,r/amazonecho,"My car key is on both sets of keys. I unintentionally grabbed my husband's set. He had to work that day and I had the only set of keys. I had to drop in on him to verify the situation, thus making him have to call into work. While he was stoked about extra sleep, I went and made a copy of the keys after I clocked out that day.",https://www.reddit.com/r/amazonecho/comments/a9a1uy/echtul7/,2018-12-25T01:45:44.000Z
